"","Institution","Program","Program_url","Code","Name","Description"
"1","Algonquin College","Forestry Technician","https://www.algonquincollege.com/pembroke/program/forestry-technician/","DAT7670","Microcomputer Applications","The ability to communicate effectively using technology is essential in the education and employment fields. Students develop and apply coll... + Read More"
"2","Algonquin College","Forestry Technician","https://www.algonquincollege.com/pembroke/program/forestry-technician/","ENL7777","Communications I","Communication remains an essential skill sought by employers, regardless of discipline or field of study. Using a practical, vocation-orient... + Read More"
"3","Algonquin College","Forestry Technician","https://www.algonquincollege.com/pembroke/program/forestry-technician/","FOR7310","The Forest Environment","Students practise the basic skills required in forestry throughout Canada. Students interpret and determine areas, coordinates, compass dire... + Read More"
"4","Algonquin College","Forestry Technician","https://www.algonquincollege.com/pembroke/program/forestry-technician/","FOR7311","Dendrology","Focus is placed on the identification of local forest vegetation in the summer and winter conditions by leaf, twig, bark, log and form. Stud... + Read More"
"5","Algonquin College","Forestry Technician","https://www.algonquincollege.com/pembroke/program/forestry-technician/","FOR7312","Ecology","Students examine the silvics of tree species, which deals with the growth and development of single trees and of forests, in their natural e... + Read More"
"6","Algonquin College","Forestry Technician","https://www.algonquincollege.com/pembroke/program/forestry-technician/","FOR7314","Soils and Landforms","The characteristics of common soils with emphasis on the physical, chemical and biological features are explored. Students spend a portion o... + Read More"
"7","Algonquin College","Forestry Technician","https://www.algonquincollege.com/pembroke/program/forestry-technician/","FOR7316","Wildlife","Students learn to identify various species of wildlife. Special emphasis is placed on the identification and management of forest hawk habit... + Read More"
"8","Algonquin College","Forestry Technician","https://www.algonquincollege.com/pembroke/program/forestry-technician/","FOR7317","Remote Sensing","Students are introduced to remote sensing using historical and modern forest imaging techniques such as LiDAR, Multispectral and Landsat. Fo... + Read More"
"9","Algonquin College","Forestry Technician","https://www.algonquincollege.com/pembroke/program/forestry-technician/","FOR7322","Forest Health","Focus is on the identification and management of diseases and insects that affect forest trees. Trees are graded for their potential as grow... + Read More"
"10","Algonquin College","Forestry Technician","https://www.algonquincollege.com/pembroke/program/forestry-technician/","ENL7679","Communications for Forestry Technicians","Students develop workplace communication skills. Topics include written and oral reports; correspondence; technical writing style; resumes; ... + Read More"
"11","Algonquin College","Forestry Technician","https://www.algonquincollege.com/pembroke/program/forestry-technician/","FOR7313","Geographic Information Systems","Analysis of digitized spatial data is presented. Students practise basic skills in manipulating and presenting data with emphasis on applica... + Read More"
"12","Algonquin College","Forestry Technician","https://www.algonquincollege.com/pembroke/program/forestry-technician/","FOR7321","Mensuration","Students determine the growth and yield of trees and forest stands. Emphasis is placed on methods and techniques of various forest inventori... + Read More"
"13","Algonquin College","Forestry Technician","https://www.algonquincollege.com/pembroke/program/forestry-technician/","FOR7324","Silviculture","Students study silviculture systems, site preparation, reforestation, tending, thinning and vegetation control. Emphasis is placed on a good... + Read More"
"14","Algonquin College","Forestry Technician","https://www.algonquincollege.com/pembroke/program/forestry-technician/","FOR7325","Harvesting","Regulations, licenses, equipment, methods, processes, and layouts employed in different harvesting systems are explored. Careful logging and... + Read More"
"15","Algonquin College","Forestry Technician","https://www.algonquincollege.com/pembroke/program/forestry-technician/","FOR7327","Fire Management","Students learn the organizational structure and practices used to control forest fires. Initial attack procedures are studied. The use of pr... + Read More"
"16","Algonquin College","Forestry Technician","https://www.algonquincollege.com/pembroke/program/forestry-technician/","FOR7340","Arboriculture","Students are introduced to the care of trees within an urban and urban-interface environment. Students practise using the different tools fo... + Read More"
"17","Algonquin College","Forestry Technician","https://www.algonquincollege.com/pembroke/program/forestry-technician/","FOR7351","Parks Operation","Students are introduced to a number of major park systems and the agencies that operate and manage them in Ontario. Students gain knowledge ... + Read More"
"18","Algonquin College","Forestry Technician","https://www.algonquincollege.com/pembroke/program/forestry-technician/","GED1108","General Education Elective","Students choose one course, from a group of general education electives, which meets one of the following five theme requirements: Arts in S... + Read More"
"19","Algonquin College","Forestry Technician","https://www.algonquincollege.com/pembroke/program/forestry-technician/","FOR7331","Land Stewardship","Best management practices of natural resources on privately owned lands are highlighted. Students examine strategies to maintain or enhance ... + Read More"
"20","Algonquin College","Forestry Technician","https://www.algonquincollege.com/pembroke/program/forestry-technician/","FOR7333","Forest Access","The proper locating of various types of forest access roads and trails is considered. Bridge and culvert sizing, installation and soil erosi... + Read More"
"21","Algonquin College","Forestry Technician","https://www.algonquincollege.com/pembroke/program/forestry-technician/","FOR7334","Forest Management","Students apply knowledge from previous courses to the realistic preparation of parts of a sustainable Forest Management Plan, and also compl... + Read More"
"22","Algonquin College","Forestry Technician","https://www.algonquincollege.com/pembroke/program/forestry-technician/","FOR7335","Ecological Land Classification","Standardized and consistent ecosystem inventory is needed by resource managers and planners. Students identify, describe and name Ontario ec... + Read More"
"23","Algonquin College","Forestry Technician","https://www.algonquincollege.com/pembroke/program/forestry-technician/","FOR7337","Tree Marking","The knowledge gained from previous and concurrent courses is brought to the practical application of tree marking. The student gains field e... + Read More"
"24","Algonquin College","Forestry Technician","https://www.algonquincollege.com/pembroke/program/forestry-technician/","FOR7339","Certifications","Students have the opportunity to gain a minimum of ten certifications in specialties that they choose from a selection that is offered. Some... + Read More"
"25","Algonquin College","Forestry Technician","https://www.algonquincollege.com/pembroke/program/forestry-technician/","FOR7346","Advanced Techniques","Global positioning systems are a critical tool for data collection and navigation in forestry. Using a combination of field exercises and se... + Read More"
"26","Algonquin College","Forestry Technician","https://www.algonquincollege.com/pembroke/program/forestry-technician/","FOR7347","Freshwater Environments","The physical, chemical and biological characteristics of freshwater environments are presented. Students specifically gain an understanding ... + Read More"
"27","Algonquin College","Forestry Technician","https://www.algonquincollege.com/pembroke/program/forestry-technician/","FOR7348","Silvicultural Surveys","Surveys, to verify the success of silvicultural operations, are essential to ensure forest sustainability. Focusing on the performance of re... + Read More"
"28","Algonquin College","Forestry Technician","https://www.algonquincollege.com/pembroke/program/forestry-technician/","FOR7352","Field Placement","Students are required to complete a two-week, volunteer, forestry-related field placement. This provides students with an opportunity to net... + Read More"
